	Name	Description	DNA-binding	Histone-interaction
IPR008979	Galactose-binding-like domain superfamily	<p>Proteins containing a galactose-binding-like domain fold can be found in several different protein families, in both eukaryotes and prokaryotes.  The common function of these domains is to bind to specific ligands, such as cell-surface-attached carbohydrate substrates for galactose oxidase and sialidase [[cite:PUB00004093]], phospholipids on the outer side of the mammalian cell membrane for coagulation factor Va [[cite:PUB00010664]], membrane-anchored ephrin for the Eph family of receptor tyrosine kinases [[cite:PUB00010665]], and a complex of broken single-stranded DNA and DNA polymerase beta for XRCC1 [[cite:PUB00005865]].</p>  <p>The structure of the galactose-binding-like domain members consists of a β-sandwich, in which the strands making up the sheets exhibit a jelly roll fold.  There is a high degree of similarity in the β-sandwich and in the loops between different family members, despite an often low level of sequence similarity.</p>	FALSE	FALSE
IPR008969	Carboxypeptidase-like, regulatory domain superfamily	<p>This domain superfamily identifies a number of eukaryotic carboxypeptidases, these include carboxypeptidase D, E (H), N, X, X2 and Z. These are metallopeptidases belong to MEROPS peptidase family M14 (clan MC), subfamily M14B.</p>  <p>Carboxypeptidase D (CPD) is a new B-type metallocarboxypeptidase that is membrane bound and has an acidic pH optimum. A hydrophobic region at the N terminus represents the signal peptide, and one near the C terminus that probably represents the transmembrane anchor. A regulatory domain within the protein has been identified as a β-sandwich, comprising 7 strands in 2 sheets in a greek-key topology. Some family members have an additional 1-2 strands to the common fold [[cite:PUB00010644]].</p>  <p>The bacterial and archaeal sequences having this signature are variously annotated, examples are:</p>  <ul> <li>Hypothetical/conserved/membrane/cell surface protein</li> <li>N-acetylglucosamine deacetylase</li> <li>Side tail fibre protein homologue from lambdoid prophage Rac</li> <li>Hypothetical tonB-linked outer membrane receptor</li> <li>OmpA-related protein</li> <li>Putative outer membrane protein, probably involved in nutrient binding</li> <li>TonB-dependent receptor</li> </ul>  <p>This entry also includes the teneurin family members, which may function as cellular signal transducers.</p>	FALSE	FALSE
IPR008984	SMAD/FHA domain superfamily	<p>FHA and SMAD (MH2) domains share a common structure consisting of a sandwich of eleven β-strands in two sheets with Greek key topology. Forkhead-associated (FHA) domains were originally identified as a sequence profile of about 75 amino acids, whereas the full-length domain is closer to about 150 amino acids. FHA domains are found in transcription factors, kinesin motors, and in a variety of other signalling molecules in organisms ranging from eubacteria to humans. FHA domains are protein-protein interaction domains that are specific for phosphoproteins. FHA-containing proteins function in maintaining cell-cycle checkpoints, DNA repair and transcriptional regulation. FHA domain proteins include the Chk2/Rad53/Cds1 family of proteins that contain one or more FHA domains, as well as a Ser/Thr kinase domain [[cite:PUB00010677], [cite:PUB00010678], [cite:PUB00010679]].</p>  <p>SMAD (Mothers against decapentaplegic (MAD) homologue) domain proteins are found in a range of species from nematodes to humans. These highly conserved proteins contain an N-terminal MH1 domain that contacts DNA, and is separated by a short linker region from the C-terminal MH2 domain, the later showing a striking similarity to FHA domains. SMAD proteins mediate signalling by the TGF-beta/activin/BMP-2/4 cytokines from receptor Ser/Thr protein kinases at the cell surface to the nucleus. SMAD proteins fall into three functional classes: the receptor-regulated SMADs (R-SMADs), including SMAD1, -2, -3, -5, and -8, each of which is involved in a ligand-specific signalling pathway [[cite:PUB00010680]]; the comediator SMADs (co-SMADs), including SMAD4, which interact with R-SMADs to participate in signalling [[cite:PUB00010681]]; and the inhibitory SMADs (I-SMADs), including SMAD6 and -7, which block the activation of R-SMADs and Co-SMADs, thereby negatively regulating signalling pathways [[cite:PUB00010682]].</p>  <p>Domains with this fold are also found as the transactivation domain of interferon regulatory factor 3 (IRF3), which has a weak homology to SMAD domains [[cite:PUB00030421]], and the N-terminal domain of EssC protein in Staphylococcus aureus.</p>	FALSE	FALSE
IPR036578	SMAD MH1 domain superfamily	<p>Smad proteins are signal transducers and transcriptional comodulators of the TGF-beta superfamily of ligands, which play a central role in regulating a broad range of cellular responses, including cell growth, differentiation, and specification of developmental fate, in diverse organisms from Caenorhabditis elegans to humans. Ligand binding to specific transmembrane receptor kinases induces receptor oligomerisation and phosphorylation of the receptor specific Smad protein (R-Smad) in the cytoplasm. The R-Smad proteins regulate distinct signalling pathways. Smad1, 5 and 8 mediate the signals of bone morphogenetic proteins (BMPs), while Smad2 and 3 mediate the signals of activins and TGF-betas. Upon ligand stimulation, R-Smad proteins are phosphorylated at the conserved C-terminal tail sequence, SS*xS* (where S* denotes a site of phosphorylation). The phosphorylated states of R-Smad proteins form heteromeric complexes with Smad4 and are translocated into the nucleus. In the nucleus, the heteromeric complexes function as gene-specific transcription activators by binding to promoters and interacting with transcriptional coactivators. Smad6 and Smad7 are inhibitory Smad proteins that inhibit TGF-beta signalling by interfering with either receptor-mediated phosphorylation or hetero-oligomerisation between Smad4 and R-Smad proteins. Smad proteins comprise two conserved MAD homology domains, one in the N terminus (MH1) and one in the C terminus (MH2), separated by a more variable, proline-rich linker region. The MH1 domain has a role in DNA binding and negatively regulates the functions of MH2 domain, whereas the MH2 domain is responsible for transactivation and mediates phosphorylation-triggered heteromeric assembly between Smad4 and R-Smad [[cite:PUB00017053], [cite:PUB00010680]].</p>	TRUE	FALSE
IPR011992	EF-hand domain pair	<p>This domain superfamily consists of a duplication of two EF-hand units, where each unit is composed of two helices connected by a twelve-residue calcium-binding loop.  The calcium ion in the EF-hand loop is coordinated in a pentagonal bipyramidal configuration. Many calcium-binding proteins contain an EF-hand type calcium-binding domain [[cite:PUB00014021], [cite:PUB00014022]]. These include:  calbindin D9K, S100 proteins such as calcyclin, polcalcin phl p 7 (a calcium-binding pollen allergen), osteonectin, parvalbumin, calmodulin [[cite:PUB00014032]] family of proteins (troponin C, caltractin, cdc4p, myosin essential chain, calcineurin, recoverin, neurocalcin), plasmodial-specific CaII-binding protein Cbp40, penta-EF-Hand proteins [[cite:PUB00014023]] (sorcin, grancalcin, calpain), as well as multidomain proteins such as phosphoinositide-specific phospholipase C, dystrophin, Cb1 and alpha-actinin. The fold consists of four helices and an open array of two hairpins.</p>	FALSE	FALSE
IPR036860	SH2 domain superfamily	<p>The Src homology 2 (SH2) domain is a protein domain of about 100 amino-acid residues first identified as a conserved sequence region between the oncoproteins Src and Fps [[cite:PUB00003647]]. Similar sequences were later found in many other intracellular signal-transducing proteins [[cite:PUB00001638]]. SH2 domains function as regulatory modules of intracellular signalling cascades by interacting with high affinity to phosphotyrosine-containing target peptides in a sequence-specific, SH2 domains recognise between 3-6 residues C-terminal to the phosphorylated tyrosine in a fashion that differs from one SH2 domain to another, and strictly phosphorylation-dependent manner [[cite:PUB00003096], [cite:PUB00001025], [cite:PUB00005506], [cite:PUB00004203]]. They are found in a wide variety of protein contexts e.g., in association with catalytic domains of phospholipase Cy (PLCy) and the non-receptor protein tyrosine kinases; within structural proteins such as fodrin and tensin; and in a group of small adaptor molecules, i.e Crk and Nck. The domains are frequently found as repeats in a single protein sequence and will then often bind both mono- and di-phosphorylated substrates.</p>  <p>The structure of the SH2 domain belongs to the α+β class, its overall shape forming a compact flattened hemisphere. The core structural elements comprise a central hydrophobic anti-parallel β-sheet, flanked by 2 short α-helices. The loop between strands 2 and 3 provides many of the binding interactions with the phosphate group of its phosphopeptide ligand, and is hence designated the phosphate binding loop, the phosphorylated ligand binds perpendicular to the β-sheet and typically interacts with the phosphate binding loop and a hydrophobic binding pocket that interacts with a pY+3 side chain. The N- and C-termini of the domain are close together in space and on the opposite face from the phosphopeptide binding surface and it has been speculated that this has facilitated their integration into surface-exposed regions of host proteins [[cite:PUB00007102]].</p>	FALSE	FALSE
IPR015988	STAT transcription factor, coiled coil	<p>The STAT protein (Signal Transducers and Activators of Transcription) family contains transcription factors that are specifically activated to regulate gene transcription when cells encounter cytokines and growth factors, hence they act as signal transducers in the cytoplasm and transcription activators in the nucleus [[cite:PUB00007134]]. Binding of these factors to cell-surface receptors leads to receptor autophosphorylation at a tyrosine, the phosphotyrosine being recognised by the STAT SH2 domain, which mediates the recruitment of STAT proteins from the cytosol and their association with the activated receptor. The STAT proteins are then activated by phosphorylation via members of the JAK family of protein kinases, causing them to dimerise and translocated to the nucleus, where they bind to specific promoter sequences in target genes. In mammals, STATs comprise a family of seven structurally and functionally related proteins: Stat1, Stat2, Stat3, Stat4, Stat5a and Stat5b, Stat6. STAT proteins play a critical role in regulating innate and acquired host immune responses. Dysregulation of at least two STAT signalling cascades (i.e. Stat3 and Stat5) is associated with cellular transformation.</p>  <p>Signalling through the JAK/STAT pathway is initiated when a cytokine binds to its corresponding receptor. This leads to conformational changes in the cytoplasmic portion of the receptor, initiating activation of receptor associated members of the JAK family of kinases. The JAKs, in turn, mediate phosphorylation at the specific receptor tyrosine residues, which then serve as docking sites for STATs and other signalling molecules. Once recruited to the receptor, STATs also become phosphorylated by JAKs, on a single tyrosine residue. Activated STATs dissociate from the receptor, dimerise, translocate to the nucleus and bind to members of the GAS (gamma activated site) family of enhancers.</p>  <p>The seven STAT proteins identified in mammals range in size from 750 and 850 amino acids. The chromosomal distribution of these STATs, as well as the identification of STATs in more primitive eukaryotes, suggest that this family arose from a single primordial gene. STATs share 6 structurally and functionally conserved domains including: an N-terminal domain (ND) that strengthens interactions between STAT dimers on adjacent DNA-binding sites; a coiled-coil STAT domain (CCD) that is implicated in protein-protein interactions; a DNA-binding domain (DBD) with an immunoglobulin-like fold similar to p53 tumour suppressor protein; an EF-hand-like linker domain connecting the DNA-binding and SH2 domains; an SH2 domain ([interpro:IPR000980]) that acts as a phosphorylation-dependent switch to control receptor recognition and DNA-binding; and a C-terminal transactivation domain [[cite:PUB00011807], [cite:PUB00051157], [cite:PUB00032712]]. The crystal structure of the N terminus of Stat4 reveals a dimer. The interface of this dimer is formed by a ring-shaped element consisting of five short helices. Several studies suggest that this N-terminal dimerisation promotes cooperativity of binding to tandem GAS elements and with the transcriptional coactivator CBP/p300.</p>	FALSE	FALSE
IPR036535	STAT transcription factor, N-terminal domain superfamily	<p>The STAT protein (Signal Transducers and Activators of Transcription) family contains transcription factors that are specifically activated to regulate gene transcription when cells encounter cytokines and growth factors, hence they act as signal transducers in the cytoplasm and transcription activators in the nucleus [[cite:PUB00007134], [cite:PUB00097377]]. The N-terminal domain of STAT is responsible for protein interactions. This domain has a multi-helical structure assembled into a hook-like structure [[cite:PUB00005229]].</p>	FALSE	FALSE
IPR016024	Armadillo-type fold	<p>This entry represents a structural domain with an armadillo (ARM)-like fold, consisting of a multi-helical fold comprised of two curved layers of α-helices arranged in a regular right-handed superhelix, where the repeats that make up this structure are arranged about a common axis [[cite:PUB00015442]]. These superhelical structures present an extensive solvent-accessible surface that is well suited to binding large substrates such as proteins and nucleic acids.</p>  <p>The sequence similarity among these different repeats or domains is low, however they exhibit considerable structural similarity. Furthermore, the number of repeats present in the superhelical structure can vary between orthologues, indicating that rapid loss/gain of repeats has occurred frequently in evolution. A common phylogenetic origin has been proposed for the armadillo and HEAT repeats [[cite:PUB00015443]].</p>	FALSE	FALSE
IPR036431	ARID DNA-binding domain superfamily	<p>The AT-rich interaction domain (ARID) is an ~100-amino acid DNA-binding module found in a large number of eukaryotic transcription factors that regulate cell proliferation, differentiation, and development [[cite:PUB00018453], [cite:PUB00018454]]. The ARID domain appears as a single-copy motif and can be found in association with other domains, such as JmjC, JmjN, Tudor and PHD-type zinc finger [[cite:PUB00018455]].</p>  <p>The basic structure of the ARID domain appears to be a series of six α-helices separated by β-strands, loops, or turns, but the structured region may extend to an additional helix at either or both ends of the basic six. Based on primary sequence homology, they can be partitioned into three structural classes:</p>  <ul><li>Minimal ARID proteins that consist of a core domain formed by six α-helices;</li>  <li>ARID proteins that supplement the core domain with an N-terminal α-helix;</li>  <li>Extended-ARID proteins, which contain the core domain and additional α-helices at their N-and C-termini.</li></ul>  <p>Minimal ARIDs are distributed in all eukaryotes, while extended ARIDs are restricted to metazoans. The ARID domain binds DNA as a monomer, recognising the duplex through insertion of a loop and an α-helix into the major groove and by extensive non-specific anchoring contacts to the adjacent sugar-phosphate backbone [[cite:PUB00018453], [cite:PUB00018454], [cite:PUB00018456]].</p>  <p>Some proteins known to contain an ARID domain are listed below:</p>  <ul><li>Eukaryotic transcription factors of the jumonji family.</li>  <li>Mammalian Bright, a B-cell-specific trans-activator of IgH transcription.</li>  <li>Mammalian PLU-1, a protein that is upregulated in breast cancer cells.</li>  <li>Mammalian RBP1 and RBP2, retinoblastoma-binding factors.</li>  <li>Mammalian Mrf-1 and Mrf-2, transcriptional modulators of the cytomegalovirus major intermediate-early promoter.</li>  <li>Drosophila melanogaster dead ringer protein, a transcriptional regulatory protein required for early embryonic development.</li>  <li>Yeast SWI1 protein, from the SWI/SNF complex involved in chromatin remodelling and broad aspects of transcription regulation.</li>  <li>Drosophila melanogaster Osa. It is structurally related to SWI1 and associates with the brahma complex, which is the Drosophila equivalent of the SWI/SNF complex.</li></ul>	TRUE	FALSE
IPR036358	Beta-trefoil domain superfamily	<p>This DNA-binding domain superfamily adopts a β-trefoil fold, that is, a capped β-barrel with internal pseudo threefold symmetry. In the DNA-binding protein LAG-1, it also is the site of mutually exclusive interactions with NotchIC (and the viral protein EBNA2) and corepressors (SMRT/N-Cor and CIR) [[cite:PUB00031569]].</p>	TRUE	FALSE
IPR036115	GCM domain superfamily	<p>GCM transcription factors are a family of proteins which contain a GCM motif. The GCM motif is a domain that has been identified in proteins belonging to a family of transcriptional regulators involved in fundamental developmental processes which comprise Drosophila melanogaster GCM and its mammalian homologues [[cite:PUB00007596], [cite:PUB00007597], [cite:PUB00007598], [cite:PUB00007599]]. In GCM transcription factors the N-terminal moiety contains a DNA-binding domain of 150 residues. Sequence conservation is highest in this GCM domain. In contrast, the C-terminal moiety contains one or two transactivating regions and is only poorly conserved.</p>  <p>The GCM motif has been shown to be a DNA binding domain that recognises preferentially the nonpalindromic octamer 5'-ATGCGGGT-3' [[cite:PUB00007596], [cite:PUB00007597], [cite:PUB00007598]]. The GCM motif contains many conserved basic amino acid residues, seven cysteine residues, and four histidine residues [[cite:PUB00007596]]. The conserved cysteines are involved in shaping the overall conformation of the domain, in the process of DNA binding and in the redox regulation of DNA binding [[cite:PUB00007598]]. The GCM domain is a new class of Zn-containing DNA-binding domain with no similarity to any other DNA-binding domain [[cite:PUB00011125]]. The GCM domain consists of a large and a small domain tethered together by one of the two Zn ions present in the structure. The large and the small domains comprise five-and three-stranded β-sheets, respectively, with three small helical segments packed against the same side of the two β-sheets. The GCM domain exercises a novel mode of sequence-specific DNA recognition, where the five-stranded β-pleated sheet inserts into the major groove of the DNA. Residues protruding from the edge strand of the β-pleated sheet and the following loop and strand contact the bases and backbone of both DNA strands, providing specificity for its DNA target site.</p>	TRUE	FALSE
IPR034882	CENP-B, dimerisation domain superfamily	<p>Centromere protein B (CENP-B) interacts with centromeric heterochromatin in chromosomes and binds to a specific subset of alphoid satellite DNA, called the CENP-B box. CENP-B may organise arrays of centromere satellite DNA into a higher order structure, which then directs centromere formation and kinetochore assembly in mammalian chromosomes.</p> <p>The CENP-B dimerisation domain is composed of two α-helices, which are folded into an antiparallel configuration. Dimerisation of CENP-B is mediated by this domain, in which monomers dimerise to form a symmetrical, antiparallel, four-helix bundle structure with a large hydrophobic patch in which 23 residues of one monomer form van der Waals contacts with the other monomer. This CENP-B dimer configuration may be suitable for capturing two distant CENP-B boxes during centromeric heterochromatin formation [[cite:PUB00031759]].</p>	TRUE	FALSE
IPR029071	Ubiquitin-like domain superfamily	<p>Ubiquitin (Ub) and Ub-like proteins are typified by a β-grasp fold. Ub-like proteins (Ubl) such as Nedd8 [[cite:PUB00069793]] and SUMO [[cite:PUB00053766]] are also covalently linked to target polypeptides, just as Ub itself. This fold is also found in Ub-related domains, such as the UBX domain [[cite:PUB00018088]] and Ras-binding domain (RBD) [[cite:PUB00018368]].</p>	FALSE	FALSE
IPR036443	Zinc finger, RanBP2-type superfamily	<p>Zinc finger (Znf) domains are relatively small protein motifs which contain multiple finger-like protrusions that make tandem contacts with their target molecule. Some of these domains bind zinc, but many do not; instead binding other metals such as iron, or no metal at all. For example, some family members form salt bridges to stabilise the finger-like folds. They were first identified as a DNA-binding motif in transcription factor TFIIIA from Xenopus laevis (African clawed frog), however they are now recognised to bind DNA, RNA, protein and/or lipid substrates [[cite:PUB00035807], [cite:PUB00035805], [cite:PUB00035806], [cite:PUB00035804], [cite:PUB00014077]]. Their binding properties depend on the amino acid sequence of the finger domains and of the linker between fingers, as well as on the higher-order structures and the number of fingers. Znf domains are often found in clusters, where fingers can have different binding specificities. There are many superfamilies of Znf motifs, varying in both sequence and structure. They display considerable versatility in binding modes, even between members of the same class (e.g. some bind DNA, others protein), suggesting that Znf motifs are stable scaffolds that have evolved specialised functions. For example, Znf-containing proteins function in gene transcription, translation, mRNA trafficking, cytoskeleton organisation, epithelial development, cell adhesion, protein folding, chromatin remodelling and zinc sensing, to name but a few [[cite:PUB00035812]]. Zinc-binding motifs are stable structures, and they rarely undergo conformational changes upon binding their target.</p>	TRUE	FALSE
IPR009061	Putative DNA-binding domain superfamily	"<p>A putative DNA-binding domain with a conserved structure is found in several different protein families. The core structure of the domain consists of a three-helical fold that is architecturally similar to that of the ""winged-helix"" fold, but is topologically distinct. Representatives of this domain can be found in domains B1 and B5 from the beta subunit of phenylalanine-tRNA synthetases [[cite:PUB00013204]], the C-terminal region of the DNA/RPA-binding domain of the DNA excision repair factor XPA [[cite:PUB00013205]], the N-terminal domain of the transcriptional activators BmrR and MtaN [[cite:PUB00013206]], the most conserved domain of the retinal development protein Dachshund [[cite:PUB00013207]], and the DNA-binding domain of the gpNU1 subunit from the bacteriophage lambda viral packing protein terminase [[cite:PUB00013208]].</p>"	TRUE	FALSE
IPR036020	WW domain superfamily	<p>The WW domain is a short conserved region in a number of unrelated proteins, which folds as a stable, triple stranded β-sheet. This short domain of approximately 40 amino acids, may be repeated up to four times in some proteins [[cite:PUB00005431], [cite:PUB00000239], [cite:PUB00001680], [cite:PUB00001690]]. The name WW or WWP derives from the presence of two signature tryptophan residues that are spaced 20-23 amino acids apart and are present in most WW domains known to date, as well as that of a conserved Pro. The WW domain binds to proteins with particular proline-motifs, [AP]-P-P-[AP]-Y, and/or phosphoserine- phosphothreonine-containing motifs [[cite:PUB00004872], [cite:PUB00007124]]. It is frequently associated with other domains typical for proteins in signal transduction processes.</p>  <p>A large variety of proteins containing the WW domain are known. These include; dystrophin, a multidomain cytoskeletal protein; utrophin, a dystrophin-like protein of unknown function; vertebrate YAP protein, substrate of an unknown serine kinase; Mus musculus (Mouse) NEDD-4, involved in the embryonic development and differentiation of the central nervous system; Saccharomyces cerevisiae (Baker's yeast) RSP5, similar to NEDD-4 in its molecular organisation; Rattus norvegicus (Rat) FE65, a transcription-factor activator expressed preferentially in liver; Nicotiana tabacum (Common tobacco) DB10 protein, amongst others.</p>	FALSE	FALSE
IPR011257	DNA glycosylase	<p>DNA glycosylases act to repair oxidative damage in DNA. These proteins are redundant as there are several different types of DNA glycosylases that are able to compensate for one another. Examples include the endonuclease III subfamily, the mismatch glycosylases subfamily, the 3-methyladenine DNA glycosylases I subfamily, and the DNA repair glycosylases subfamily [[cite:PUB00014479]].</p>	FALSE	FALSE
