	Name	Description	DNA-binding	Histone-interaction
IPR046341	SET domain superfamily	<p>The SET domain is a 130 to 140 amino acid, evolutionary well conserved sequence motif that was initially characterised in the Drosophila proteins Su(var)3-9, Enhancer-of-zeste and Trithorax [[cite:PUB00018233], [cite:PUB00014448]]. In eukaryotic organisms, it appears in proteins with an important role in regulating chromatin-mediated gene transcriptional activation and silencing. In viruses,bacteria and archaea, its function is not clear yet [[cite:PUB00099756]].</p>  <p>This superfamily includes eukaryotic proteins with histone methyltransferase activity, which requires the combination of the SET domain with the adjacent cysteine-rich regions, one located N-terminally (pre-SET) and the other posterior to the SET domain (post-SET). Post- and pre- SET regions seem then to play a crucial role when it comes to substrate recognition and enzymatic activity [[cite:PUB00054125], [cite:PUB00007133]]. Other SET domain-containing proteins function as transcription factors (such as PR domain zinc finger protein 1 from humans [[cite:PUB00099755]]).</p>  <p>The structure of the SET domain and the two adjacent regions pre-SET and post-SET have been solved [[cite:PUB00018235], [cite:PUB00018236], [cite:PUB00018237]]. The SET domain structure is all-β, but consists only in sets of few short strands composing no more than a couple of small sheets. Consequently the SET structure is mostly defined by turns and loops. An unusual feature is that the SET core is made up of two discontinuous segments of the primary sequence forming an approximate L-shape [[cite:PUB00005822], [cite:PUB00054125], [cite:PUB00007133]]. Two of the most conserved motifs in the SET domain are constituted by a stretch at the C-terminal containing a strictly conserved tyrosine residue and a preceding loop inside which the C-terminal segment passes forming a knot-like structure, but not quite a true knot. These two regions have been proven to be essential for SAM binding and catalysis, particularly the invariant tyrosine where in all likelihood catalysis takes place [[cite:PUB00054125], [cite:PUB00007133]].</p>	FALSE	TRUE
IPR009060	UBA-like superfamily	<p>UBA domains are a commonly occurring sequence motif of approximately 45 amino acid residues that are found in diverse proteins involved in the ubiquitin/proteasome pathway, DNA excision-repair, and cell signalling via protein kinases [[cite:PUB00007089]]. HHR23A, the human homologue of yeast Rad23A is a nucleotide excision-repair protein that contains both an internal and a C-terminal UBA domain. The fold of the UBA domain consists of a compact three-helical bundle with a right-handed twist, and have a conserved hydrophobic surface patch for protein-protein interactions. UBA-like domains can be found in other proteins as well, such as the TS-N domain in the elongation factor Ts (EF-Ts), which catalyses the recycling of the GTPase EF-Tu required for the binding of aminoacyl-tRNA top the ribosomal A site [[cite:PUB00013202]]; and the C-terminal domain of TAP/NXF1, which functions in nuclear export through the interaction of its UBA-like domain with FG nucleoporins [[cite:PUB00013203]].</p>	FALSE	FALSE
IPR036407	DM DNA-binding domain superfamily	<p>This entry represents the DM DNA-binding domain superfamily.</p>	TRUE	FALSE
IPR036879	Transcription factor, MADS-box superfamily	<p>Human serum response factor (SRF) is a ubiquitous nuclear protein important for cell proliferation and differentiation. SRF function is essential for transcriptional regulation of numerous growth-factor-inducible genes, such as c-fos oncogene and muscle-specific actin genes.  A core domain of around 90 amino acids is sufficient for the activities of DNA-binding, dimerisation and interaction with accessory factors. Within the core is a DNA-binding region, designated the MADS box [[cite:PUB00004216]], that is highly similar to many eukaryotic regulatory proteins: among these are MCM1, the regulator of cell type-specific genes in fission yeast; DSRF, a Drosophila trachea development factor; the MEF2 family of myocyte-specific enhancer factors; and the Agamous and Deficiens families of plant homeotic proteins.</p>  <p>In SRF, the MADS box has been shown to be involved in DNA-binding and dimerisation [[cite:PUB00000821]]. Proteins belonging to the MADS family function as dimers, the primary DNA-binding element of which is an anti-parallel coiled coil of two amphipathic α-helices, one from each subunit. The DNA wraps around the coiled coil allowing the basic N-termini of the helices to fit into the DNA major groove. The chain extending from the helix N-termini reaches over the DNA backbone and penetrates into the minor groove. A 4-stranded, anti-parallel β-sheet packs against the coiled-coil face opposite the DNA and is the central element of the dimerisation interface.  The MADS-box domain is commonly found associated with K-box region see ([interpro:IPR002487]).</p>	TRUE	FALSE
IPR035979	RNA-binding domain superfamily	<p>Many eukaryotic proteins containing one or more copies of a putative RNA-binding domain of about 90 amino acids are known to bind single-stranded RNAs [[cite:PUB00005341], [cite:PUB00034493], [cite:PUB00034494]]. The largest group of single strand RNA-binding proteins is the eukaryotic RNA recognition motif (RRM) family that contains an eight amino acid RNP-1 consensus sequence [[cite:PUB00001891], [cite:PUB00034495]]. RRM proteins have a variety of RNA binding preferences and functions, and include heterogeneous nuclear ribonucleoproteins (hnRNPs), proteins implicated in regulation of alternative splicing (SR, U2AF, Sxl), protein components of small nuclear ribonucleoproteins (U1 and U2 snRNPs), and proteins that regulate RNA stability and translation (PABP, La, Hu) [[cite:PUB00034493], [cite:PUB00034494], [cite:PUB00034495]]. The RRM in heterodimeric splicing factor U2 snRNP auxiliary factor (U2AF) appears to have two RRM-like domains with specialised features for protein recognition [[cite:PUB00016352]]. The motif also appears in a few single stranded DNA binding proteins.</p>  <p>The typical RRM consists of four anti-parallel β-strands and two α-helices arranged in a β-α-β-β-α-β fold with side chains that stack with RNA bases. Specificity of RNA binding is determined by multiple contacts with surrounding amino acids. A third helix is present during RNA binding in some cases [[cite:PUB00004440]]. The RRM is reviewed in a number of publications [[cite:PUB00034496], [cite:PUB00034497], [cite:PUB00034498]].</p>  <p>This entry also includes some bacterial putative RNA-binding proteins.</p>	FALSE	FALSE
IPR016194	SPOC-like, C-terminal domain superfamily	<p>This superfamily represents the Spen Paralogue and Orthologue C-terminal (SPOC) domain and its structural homologues. This domain has a closed β-barrel fold of complex topology. Proteins that carry a SPOC-like domain include:</p>  <ul> <li>Spen proteins, such as SHARP (SMRT/HDAC1-associated repressor protein), which carry a SPOC domain at the C-terminal and an RNA-binding motif in the N-terminal; Spen proteins regulate the expression of key transcriptional effectors in diverse signalling pathways, the SHARP protein being a component of transcriptional repression complexes in both nuclear receptor and Notch/RBP-Jkappa signalling pathways [[cite:PUB00013949]].</li> </ul>  <ul> <li>The middle domains of Ku70 and Ku80 (which includes the C-terminal α-helical arm and the DNA encircling insertion); the Ku heterodimer, which is composed of Ku70 and Ku80 subunits, contributes to genomic integrity through its ability to bind DNA double-strand breaks and facilitate repair by the non-homologous end-joining pathway [[cite:PUB00007947]].</li> </ul>	FALSE	FALSE
IPR009072	Histone-fold	<p>Histones mediate DNA organisation and play a dominant role in regulating eukaryotic transcription. The histone-fold consists of a core of three helices, where the long middle helix is flanked at each end by shorter ones. The histone fold is a structural element that facilitates heterodimerisation [[cite:PUB00060941], [cite:PUB00060942], [cite:PUB00039806]]. Proteins displaying this structure include the nucleosome core histones, which form octomers composed of two copies of each of the four histones, H2A, H2B, H3 and H4; archaeal histone, which possesses only the core domain part of eukaryotic histone; and the TATA-box binding protein (TBP)-associated factors (TAF), where the histone fold is a common motif for mediating TAF-TAF interactions. TAF proteins include TAF(II)18 and TAF(II)28, which form a heterodimer, TAF(II)42 and TAF(II)62, which form a heterotetramer similar to (H3-H4)2, and the negative cofactor 2 (NC2) alpha and beta chains, which form a heterodimer. The TAF proteins are a component of transcription factor IID (TFIID), along with the TBP protein. TFIID forms part of the pre-initiation complex on core promoter elements required for RNA polymerase II-dependent transcription. The TAF subunits of TFIID mediate transcriptional activation of subsets of eukaryotic genes. The NC2 complex mediates the inhibition of TATA-dependent transcription through interactions with TBP.</p>	FALSE	TRUE
IPR010919	SAND-like domain superfamily	<p>The SAND domain (named after Sp100, AIRE-1, NucP41/75, DEAF-1) is a conserved ~80 residue region found in a number of nuclear proteins, many of which function in chromatin-dependent transcriptional control. These include proteins linked to various human diseases, such as the Sp100 (Speckled protein 100kDa), NUDR (Nuclear DEAF-1 related), GMEB (Glucocorticoid Modulatory Element Binding) proteins and AIRE-1 (Autoimmune regulator 1) proteins.</p>  <p>Proteins containing the SAND domain have a modular structure; the SAND domain can be associated with a number of other modules, including the bromodomain, the PHD finger and the MYND finger. Because no SAND domain has been found in yeast, it is thought that the SAND domain could be restricted to animal phyla. Many SAND domain-containing proteins, including NUDR, DEAF-1 (Deformed epidermal autoregulatory factor-1) and GMEB, have been shown to bind DNA sequences specifically. The SAND domain has been proposed to mediate the DNA binding activity of these proteins [[cite:PUB00005483], [cite:PUB00007101]]. Structurally, the SAND domain consists of a novel α/β fold, which has a core of three short helices packed against a barrel-like β-sheet; it is structurally similar to the SH3-like fold.</p>  <p>Other proteins display domains that are structurally similar to the SAND domain. One such example is the SMAD4-binding domain of the oncoprotein Ski, which is stabilised by a bound zinc atom, and resembles a SAND domain, in which the corresponding I loop is responsible for DNA binding. Ski is able to disrupt the formation of a functional complex between the Co- and R-SMADs, leading to the repression of TGF-beta, Activin and BMP responses, resulting in the repression of TGF-signalling [[cite:PUB00013959]].</p>	FALSE	FALSE
IPR036427	Bromodomain-like superfamily	<p>Bromodomains are found in a variety of mammalian, invertebrate and yeast DNA-binding proteins [[cite:PUB00004405]]. Bromodomains are highly conserved α-helical motifs that can specifically interact with acetylated lysine residues on histone tails [[cite:PUB00005462], [cite:PUB00097275]]. In some proteins, the classical bromodomain has diverged to such an extent that parts of the region are either missing or contain an insertion (e.g., mammalian protein HRX, Caenorhabditis elegans hypothetical protein ZK783.4, yeast protein YTA7). The bromodomain may occur as a single copy, or in duplicate.</p>  <p>This domain is present in proteins involved in a wide range of functions such as acetylating histones, remodelling chromatin, and recruiting other factors necessary for transcription, thus playing a critical role in the regulation of transcription [[cite:PUB00097276]].</p>	FALSE	TRUE
IPR016177	DNA-binding domain superfamily	<p>This superfamily represents a DNA-binding domain with a 2-layer β(3)-α fold that is found in several DNA-binding proteins, including:</p>  <ul> <li>DNA-binding domain of tn916 integrase [[cite:PUB00007416]].</li> <li>N-terminal DNA-binding domain of lambda integrase [[cite:PUB00038703]].</li> <li>GCC-box DNA-binding domains of certain transcription factors [[cite:PUB00018484]].</li> <li>Methyl-CpG DNA-binding domain found in Methyl-CpG-binding protein 2 (MECP2) [[cite:PUB00030284]] and methylation-dependent transcriptional repressor MBD1/PCM1 [[cite:PUB00015392]].</li> </ul>	TRUE	FALSE
IPR014756	Immunoglobulin E-set	"<p>The immunoglobulin (Ig) like fold, which consists of a β-sandwich of seven or more strands in two sheets with a greek-key topology, is one of the most common protein modules found in animals. Many different unrelated proteins share an Ig-like fold, which is often involved in interactions, commonly with other Ig-like domains via their β-sheets [[cite:PUB00003330]]. Of these, the ""early"" set (E set) domains are possibly related to the immunoglobulin ([interpro:IPR007110]) and/or fibronectin type III ([interpro:IPR003961]) Ig-like protein superfamilies. Ig-like E set domains include: <ul> <li>C-terminal domain of certain transcription factors, such as the pro-inflammatory transcription factor NF-kappaB, and the T-cell transcription factors NFAT1 and NFAT5 [[cite:PUB00035293]].</li> <li>Ig-like domains of sugar-utilising enzymes, such as galactose oxidase (C-terminal domain), sialidase (linker domain), and maltogenic amylase (N-terminal domain).</li> <li>C-terminal domain of arthropod haemocyanin, where many loops are inserted into the fold. These proteins act as dioxygen-transporting proteins.</li> <li>C-terminal domain of class II viral fusion proteins. These envelope glycoproteins are responsible for membrane fusion with target cells during viral invasion.</li> <li>Cytomegaloviral US (unique short) proteins. These type I membrane proteins help suppress the host immune response by modulating surface expression of MHC class I molecules [[cite:PUB00035294]].</li> <li>Molybdenium-containing oxidoreductase-like dimerisation domain found in enzymes such as sulphite reductase.</li> <li>ML domains found in cholesterol-binding epididymal secretory protein E1, and in a major house-dust mite allergen; ML domains are implicated in lipid recognition, particularly the recognition of pathogen-related products.</li> <li>Rho-GDI-like signalling proteins, which regulate the activity of small G proteins [[cite:PUB00035295]].</li> <li>Cytoplasmic domain of inward rectifier potassium channels such as Girk1 and Kirbac1.1. These channels act as regulators of excitability in eukaryotic cells.</li> <li>N-terminal domain of transglutaminases, including coagulation factor XIII; many loops are inserted into the fold in these proteins. These proteins act to catalyse the cross-linking of various protein substrates [[cite:PUB00035296]].</li> <li>Filamin repeat rod domain found in proteins such as the F-actin cross-linking gelation factor ABP-120. These proteins interact with a variety of cellular proteins, acting as signalling scaffolds [[cite:PUB00035297]].</li> <li>Arrestin family of proteins, which contain a tandem repeat of two elaborated Ig-like domains contacting each other head-to-head. These proteins are key to the redirection of GPCR signals to alternative pathways [[cite:PUB00035298]].</li> <li>C-terminal domain of arginine-specific cysteine proteases, such as Gingipain-R, which act as major virulence factors of Porphyromonas gingivalis (Bacteroides gingivalis).</li> <li>Copper-resistance proteins, such as CopC, which act as copper-trafficking proteins [[cite:PUB00029122]].</li> <li>Cellulosomal scaffoldin proteins, such as CipC module x2.1. These proteins act as scaffolding proteins of cellulosomes, which contain cellulose-degrading enzymes [[cite:PUB00035299]].</li> <li>Quinohaemoprotein amine dehydrogenases (A chain), which contain a tandem repeat of two Ig-like domains. These proteins function in electron transfer reactions.</li> <li>Internalin Ig-like domains, which are truncated and fused to a leucine-rich repeat domain. These proteins are required for host cell invasion of Listeria species.</li> </ul> </p>"	FALSE	FALSE
IPR036674	p53-like tetramerisation domain superfamily	<p>This entry represents the tetramerisation domain of p53. The tetramerisation domain of human p53 extends from residues 325 to 356, and has a 4-helical bundle fold. The tetramerisation domain is essential for DNA binding, protein-protein interactions, post-translational modifications, and p53 degradation [[cite:PUB00014037], [cite:PUB00054382]].</p>	TRUE	FALSE
IPR011029	Death-like domain superfamily	<p>This superfamily represents the death domain and other structurally similar domains, including DED, CARD and the DAPIN domain.</p>	FALSE	FALSE
IPR036770	Ankyrin repeat-containing domain superfamily	<p>This entry represents the ankyrin repeat-containing domain. These domains contain multiple repeats of a β(2)-α(2) motif. The ankyrin repeat is one of the most common protein-protein interaction motifs in nature. Ankyrin repeats are tandemly repeated modules of about 33 amino acids. They occur in a large number of functionally diverse proteins mainly from eukaryotes. The few known examples from prokaryotes and viruses may be the result of horizontal gene transfers [[cite:PUB00006219]]. The repeat has been found in proteins of diverse function such as transcriptional initiators, cell-cycle regulators, cytoskeletal, ion transporters and signal transducers. The ankyrin fold appears to be defined by its structure rather than its function since there is no specific sequence or structure which is universally recognised by it.</p>	FALSE	FALSE
IPR027417	P-loop containing nucleoside triphosphate hydrolase	<p>The P-loop NTPase fold is the most prevalent domain of the several distinct nucleotide-binding protein folds.</p>  <p>The most common reaction catalysed by enzymes of the P-loop NTPase fold is the hydrolysis of the beta-gamma phosphate bond of a bound nucleoside triphosphate (NTP). The energy from NTP hydrolysis is typically utilised to induce conformational changes in other molecules, which constitutes the basis of the biological functions of most P-loop NTPases. P-loop NTPases show substantial substrate preference for either ATP or GTP [[cite:PUB00064266]].</p>	FALSE	FALSE
IPR009110	Nuclear receptor coactivator, interlocking	<p>This superfamily represents the interlocking domain of various eukaryotic nuclear receptor coactivators, including CREBP, P300, Ncoa1, Ncoa2 and Ncoa3. The interlocking domain forms a 3-helical non-globular array that forms interlocked heterodimers with its target.</p> <p>Nuclear receptors are ligand-activated transcription factors involved in the regulation of many processes, including development, reproduction and homeostasis. Nuclear receptor coactivators act to modulate the function of nuclear receptors. Coactivators associate with promoters and enhancers primarily through protein-protein contacts to facilitate the interaction between DNA-bound transcription factors and the transcription machinery. Many of these coactivators are structurally related, including CBP (CREB-binding protein), P300 and ACTR (activator for thyroid and retinoid receptors) [[cite:PUB00013275]]. CBP and P300 both have histone acetyltransferase activity ([ec:2.3.1.48]). CBP/P300 proteins function synergistically to activate transcription, acting to remodel chromatin and to recruit RNA polymerase II and the basal transcription machinery. CBP is required for proper cell cycle control, differentiation and apoptosis. The interaction of CBP/P300 with transcription factors involves several small domains. The IBiD domain in the C-terminal of CBP is responsible for CBP interaction with IRF-3, as well as with the adenoviral oncoprotein E1A, TIF-2 coactivator, and the IRF homologue KSHV IRF-1 [[cite:PUB00013276]].</p> <p>Ncoa1, Ncoa2 and Ncoa3 are all coactivators of various nuclear receptors. In addition, Ncoa1 and Ncoa3 both have histone acetyltransferase activity, but Ncoa2 does not [[cite:PUB00029464], [cite:PUB00035991]].</p>	FALSE	FALSE
IPR036867	R3H domain superfamily	<p>The R3H domain superfamily is a conserved sequence motif found in proteins from a diverse range of organisms including eubacteria, green plants, fungi and various groups of metazoans, but not in archaea and Escherichia coli. The domain is named R3H because it contains an invariant arginine and a highly conserved histidine, that are separated by three residues. It also displays a conserved pattern of hydrophobic residues, prolines and glycines. It can be found alone, in association with AAA domain or with various DNA/RNA binding domains like DSRM, KH, G-patch, PHD, DEAD box, or RRM. The functions of these domains indicate that the R3H domain might be involved in polynucleotide-binding, including DNA, RNA and single-stranded DNA [[cite:PUB00005485]].</p>  <p>The 3D structure of the R3H domain has been solved. The fold presents a small motif, consisting of a three-stranded antiparallel β-sheet, against which two α-helices pack from one side. This fold is related to the structures of the YhhP protein and the C-terminal domain of the translational initiation factor IF3. Three conserved basic residues cluster on the same face of the R3H domain and could play a role in nucleic acid recognition. An extended hydrophobic area at a different site of the molecular surface could act as a protein-binding site [[cite:PUB00018517]].</p>	TRUE	FALSE
IPR012337	Ribonuclease H-like superfamily	<p>The catalytic domain of several polynucleotidyl transferases share a similar structure, consisting of a 3-layer α/β/α fold that contains mixed β-sheets, suggesting that they share a similar mechanism of catalysis. Polynucleotidyl transferases containing this domain include ribonuclease H class I (RNase HI) and class II (RNase HII), HIV RNase (reverse transcriptase domain), retroviral integrase (catalytic domain), Mu transposase (core domain), transposase inhibitor Tn5 (containing additional all-α subdomains), DnaQ-like 3'-5' exonucleases (exonuclease domains), RuvC resolvase, and mitochondrial resolvase ydc2 (catalytic domain) [[cite:PUB00016296], [cite:PUB00016297], [cite:PUB00016298]].</p>	FALSE	FALSE
IPR036915	Cyclin-like superfamily	<p>This cyclin-like domain superfamily is found in cyclins, but it is also found as the core domain in transcription factor IIB (TFIIB) [[cite:PUB00022837]] and in the retinoblastoma tumour suppressor [[cite:PUB00049281]]. It consists of a duplication of a fold consisting of 5 helices, one of them surrounded by the others.</p>	FALSE	FALSE
IPR029063	S-adenosyl-L-methionine-dependent methyltransferase superfamily	<p>This entry represents  S-adenosyl-L-methionine-dependent methyltransferases (SAM MTase). Methyltransferases transfer a methyl group from a donor to an acceptor. SAM-binding methyltransferases utilise the ubiquitous methyl donor SAM as a cofactor to methylate proteins, small molecules, lipids, and nucleic acids. All SAM MTases contain a structurally conserved SAM-binding domain consisting of a central seven-stranded β-sheet that is flanked by three α-helices per side of the sheet [[cite:PUB00045026]].</p>  <p>A review published in 2003 [[cite:PUB00054125]] divides all methyltransferases into 5 classes based on the structure of their catalytic domain (fold):</p>  <ul> <li>class I: Rossmann-like α/β</li> <li>class II: TIM β/α-barrel α/β</li> <li>class III: tetrapyrrole methylase α/β</li> <li>class IV: SPOUT α/β</li> <li>class V: SET domain all β</li></ul>  <p>Another paper [[cite:PUB00057958]] based on a study of the Saccharomyces cerevisiae methyltransferome argues for four more folds:</p>  <ul> <li>class VI: transmembrane all-α</li> <li>class VII: DNA/RNA-binding 3-helical bundle all-α</li> <li>class VIII: SSo0622-like α+β</li> <li>class IX: thymidylate synthetase α+β</li></ul>  <p>The vast majority of methyltransferases belong to the Rossmann-like fold (Class I) which consists in a seven-stranded β-sheet adjoined by α-helices. The β-sheet contains a central topological switch-point resulting in a deep cleft in which SAM binds. Class I methyltransferases display two conserved positions, the first one is a GxGxG motif (or at least a GxG motif) at the end of the first β-strand which is characteristic of a nucleotide-binding site and is hence used to bind the adenosyl part of SAM, the second conserved position is an acidic residue at the end of the second β-strand that forms one hydrogen bond to each hydroxyl of the SAM ribose part. The core of these enzymes is composed by about 150 amino acids that show very strong spatial conservation [[cite:PUB00054125]].</p>	FALSE	FALSE
IPR036096	Ataxin, AXH domain superfamily	<p>Spinocerebellar ataxia type 1 is late-onset neurodegenerative diseases caused by the expansion of a CAG triplet repeat in the SCA1 gene. This results in the lengthening of a polyglutamine tract in the gene product ataxin-1 producing a toxic gain of function that results in neuronal death.</p>	FALSE	FALSE
