	Name	Description	DNA-binding	Histone-interaction
IPR009057	Homedomain-like superfamily	<p>Homeodomain (HD)-containing proteins are transcription factors that share a related DNA binding domain [[cite:PUB00013192]]. HD was first identified in a number of Drosophila homeotic and segmentation proteins, but is now known to be well conserved in organisms from all domains in life. The domain binds DNA through a helix-turn-helix (HTH) structure. The HTH motif is characterised by two α-helices, which make intimate contacts with the DNA and are joined by a short turn. The second helix binds to DNA via a number of hydrogen bonds and hydrophobic interactions, which occur between specific side chains and the exposed bases and thymine methyl groups within the major groove of the DNA. The first helix helps to stabilise the structure. Many proteins contain homeodomains, including Drosophila Engrailed, yeast mating type proteins, hepatocyte nuclear factor 1a and HOX proteins.</p>  <p>The homeodomain motif is very similar in sequence and structure to domains in a wide range of DNA-binding proteins, including recombinases, Myb proteins, GARP response regulators, human telomeric proteins (hTRF1), paired domain proteins (PAX), yeast RAP1, centromere-binding proteins CENP-B and ABP-1, transcriptional regulators (TyrR), AraC-type transcriptional activators, and tetracycline repressor-like proteins (TetR, QacR, YcdC) [[cite:PUB00013193], [cite:PUB00013194], [cite:PUB00003347]].</p>	TRUE	FALSE
IPR036910	High mobility group box domain superfamily	<p>High mobility group (HMG) box domains are involved in binding DNA, and may be involved in protein-protein interactions as well. The structure of the HMG-box domain consists of three helices in an irregular array. HMG-box domains are found in one or more copies in HMG-box proteins, which form a large, diverse family involved in the regulation of DNA-dependent processes such as transcription, replication, and strand repair, all of which require the bending and unwinding of chromatin. Many of these proteins are regulators of gene expression. HMG-box proteins are found in a variety of eukaryotic organisms, and can be broadly divided into two groups, based on sequence-dependent and sequence-independent DNA recognition; the former usually contain one HMG-box motif, while the latter can contain multiple HMG-box motifs.</p> <p>HMG-box domains can be found in single or multiple copies in the following protein classes:  HMG1 and HMG2 non-histone components of chromatin; SRY (sex determining region Y protein) involved in differential gonadogenesis; the SOX family of transcription factors [[cite:PUB00015128]]; sequence-specific LEF1 (lymphoid enhancer binding factor 1) and TCF-1 (T-cell factor 1) involved in regulation of organogenesis and thymocyte differentiation [[cite:PUB00015129]]; structure-specific recognition protein SSRP involved in transcription and replication; MTF1 mitochondrial transcription factor; nucleolar transcription factors UBF 1/2 (upstream binding factor) involved in transcription by RNA polymerase I; Abf2 yeast ARS-binding factor [[cite:PUB00015130]]; yeast transcription factors lxr1, Rox1, Nhp6b and Spp41; mating type proteins (MAT) involved in the sexual reproduction of fungi [[cite:PUB00015131]]; and the YABBY plant-specific transcription factors.</p>	TRUE	FALSE
IPR036051	Krueppel-associated box domain superfamily	<p>The Krueppel-associated box (KRAB) is a domain of around 75 amino acids that is found in the N-terminal part of about one third of eukaryotic Krueppel-type C2H2 zinc finger proteins (ZFPs) [[cite:PUB00011911]]. It is enriched in charged amino acids and can be divided into subregions A and B, which are predicted to fold into two amphipathic α-helices. The KRAB A and B boxes can be separated by variable spacer segments and many KRAB proteins contain only the A box [[cite:PUB00007161]].</p>  <p>The functions currently known for members of the KRAB-containing protein family include transcriptional repression of RNA polymerase I, II and III promoters, binding and splicing of RNA, and control of nucleolus function. The KRAB domain functions as a transcriptional repressor when tethered to the template DNA by a DNA-binding domain. A sequence of 45 amino acids in the KRAB A subdomain has been shown to be necessary and sufficient for transcriptional repression. The B box does not repress by itself but does potentiate the repression exerted by the KRAB A subdomain [[cite:PUB00007162], [cite:PUB00007163]]. Gene silencing requires the binding of the KRAB domain to the RING-B box-coiled coil (RBCC) domain of the KAP-1/TIF1-beta corepressor. As KAP-1 binds to the heterochromatin proteins HP1, it has been proposed that the KRAB-ZFP-bound target gene could be silenced following recruitment to heterochromatin [[cite:PUB00007164], [cite:PUB00007165]].</p>  <p>KRAB-ZFPs probably constitute the single largest class of transcription factors within the human genome [[cite:PUB00007166]]. The KRAB domain is generally encoded by two exons. The regions coded by the two exons are known as KRAB-A and KRAB-B. Although the function of KRAB-ZFPs is largely unknown, they appear to play important roles during cell differentiation and development. These proteins have been shown to play important roles in cell differentiation and organ development, and in regulating viral replication and transcription. A KRAB domain may consist of an A-box, or of an A-box plus either a B-box, a divergent B-box (b), or a C-box. Only the A-box is included in this model. The A-box is needed for repression, the B- and C- boxes are not. KRAB-ZFPs have one or two KRAB domains at their amino-terminal end, and multiple C2H2 zinc finger motifs at their C-termini. Some KRAB-ZFPs also contain a SCAN domain which mediates homo- and hetero-oligomerization. The KRAB domain is a protein-protein interaction module which represses transcription through recruiting corepressors. A key mechanism appears to be the following: KRAB-AFPs tethered to DNA recruit, via their KRAB domain, the repressor KAP1 (KRAB-associated protein-1, also known as transcription intermediary factor 1 beta, KRAB-A interacting protein and tripartite motif protein 28). The KAP1/ KRAB-AFP complex in turn recruits the heterochromatin protein 1 (HP1) family, and other chromatin modulating proteins, leading to transcriptional repression through heterochromatin formation [[cite:PUB00097514]].</p>	FALSE	FALSE
IPR036236	Zinc finger C2H2 superfamily	<p>C2H2-type (classical) zinc fingers (Znf) were the first class to be characterised. They contain a short β-hairpin and an α-helix (β/β/α structure), where a single zinc atom is held in place by Cys(2)His(2) (C2H2) residues in a tetrahedral array. C2H2 Znf's can be divided into three groups based on the number and pattern of fingers: triple-C2H2 (binds single ligand), multiple-adjacent-C2H2 (binds multiple ligands), and separated paired-C2H2 [[cite:PUB00035808]]. C2H2 Znf's are the most common DNA-binding motifs found in eukaryotic transcription factors, and have also been identified in prokaryotes [[cite:PUB00035809]].  Transcription factors usually contain several Znf's (each with a conserved β/β/α structure) capable of making multiple contacts along the DNA, where the C2H2 Znf motifs recognise DNA sequences by binding to the major groove of DNA via a short α-helix in the Znf, the Znf spanning 3-4 bases of the DNA [[cite:PUB00035811]]. C2H2 zinc fingers can also bind to RNA and protein targets [[cite:PUB00043274]].</p>	TRUE	FALSE
IPR012340	Nucleic acid-binding, OB-fold	<p>A five-stranded β-barrel was first noted as a common structure among four proteins binding single-stranded nucleic acids (staphylococcal nuclease and aspartyl-tRNA synthetase) or oligosaccharides (B subunits of enterotoxin and verotoxin-1), and has been termed the oligonucleotide/oligosaccharide binding motif, or OB fold, a five-stranded β-sheet coiled to form a closed β-barrel capped by an α helix located between the third and fourth strands [[cite:PUB00016307]]. Two ribosomal proteins, S17 and S1, are members of this class and have different variations of the OB fold theme. Comparisons with other OB fold nucleic acid binding proteins suggest somewhat different mechanisms of nucleic acid recognition in each case [[cite:PUB00011768]].</p>  <p>There are many nucleic acid-binding proteins that contain domains with this OB-fold structure, including:</p>  <ul><li>Large ribosomal subunit protein uL2</li>   <li>Small ribosomal subunit protein uS12</li>   <li>DNA ligase</li>   <li>Polyribonucleotide nucleotidyltransferase</li>   <li>Phage ssDNA-binding proteins (gp32, gp2.5, gpV)</li>   <li>Holliday junction branch migration complex subunit RuvA</li>   <li>Elongation factor P</li></ul>	FALSE	FALSE
IPR036390	Winged helix DNA-binding domain superfamily	"<p>Winged helix DNA-binding proteins share a related winged helix-turn-helix DNA-binding motif, where the ""wings"", or loops, are small β-sheets. The winged helix motif consists of two wings (W1, W2), three α-helices (H1, H2, H3) and three β-sheets (S1, S2, S3) arranged in the order H1-S1-H2-H3-S2-W1-S3-W2 [[cite:PUB00013195]]. The DNA-recognition helix makes sequence-specific DNA contacts with the major groove of DNA, while the wings make different DNA contacts, often with the minor groove or the backbone of DNA. Several winged-helix proteins display an exposed patch of hydrophobic residues thought to mediate protein-protein interactions.</p>"	TRUE	FALSE
IPR036647	GTF2I-like repeat superfamily	<p>This region of sequence similarity is found up to six times in a variety of proteins including general transcription factor II-I (GTF2I). It has been suggested that this may be a DNA binding domain [[cite:PUB00007426], [cite:PUB00007427]].</p>	TRUE	FALSE
IPR037241	E2F-DP heterodimerization region	<p>The E2F transcription factors associated with the corresponding domain of the DP transcription factor forming an heterodimer fold with the N-terminal long helices of both chains forming a parallel coiled coil and their C-terminal folded β-hairpins interlocking together in a β-sandwich. This complex binds the C terminus of retinoblastoma protein [[cite:PUB00035382]].</p>	FALSE	FALSE
IPR036638	Helix-loop-helix DNA-binding domain superfamily	<p>This domain is found in a number of eukaryotic proteins, which probably are sequence specific DNA-binding proteins that act as transcription factors, share a conserved domain of 40 to 50 amino acid residues. It has been proposed [[cite:PUB00000825]] that this domain is formed of two amphipathic helices joined by a variable length linker region that could form a loop. This 'helix-loop-helix' (HLH) domain mediates protein dimerisation and has been found in the proteins listed below [[cite:PUB00001514]]. Most of these proteins have an extra basic region of about 15 amino acid residues that is adjacent to the HLH domain and specifically binds to DNA. They are referred as basic helix-loop-helix proteins (bHLH), and are classified in two groups: class A (ubiquitous) and class B (tissue-specific). Members of the bHLH family bind variations on the core sequence 'CANNTG', also referred to as the E-box motif. The homo- or heterodimerisation mediated by the HLH domain is independent of, but necessary for DNA binding, as two basic regions are required for DNA binding activity. The HLH proteins lacking the basic domain (Emc, Id) function as negative regulators, since they form heterodimers, but fail to bind DNA. The hairy-related proteins (hairy, E(spl), deadpan) also repress transcription although they can bind DNA. The proteins of this subfamily act together with co-repressor proteins, like groucho, through their -terminal motif WRPW.</p>	TRUE	FALSE
IPR013761	Sterile alpha motif/pointed domain superfamily	<p>Sterile alpha motif (SAM) domains are known to be involved in diverse protein-protein interactions, associating with both SAM-containing and non-SAM-containing proteins pathway [[cite:PUB00014041]]. SAM domains exhibit a conserved structure, consisting of a 4-5-helical bundle of two orthogonally packed α-hairpins. However SAM domains display a diversity of function, being involved in interactions with proteins, DNA and RNA [[cite:PUB00014042]]. The name sterile alpha motif arose from its presence in proteins that are essential for yeast sexual differentiation. The SAM domain has had various names, including SPM, PTN (pointed), SEP (yeast sterility, Ets-related, PcG proteins), NCR (N-terminal conserved region) and HLH (helix-loop-helix) domain, all of which are related and can be classified as SAM domains.</p> <p>SAM domains occur in eukaryotic and in some bacterial proteins. Structures have been determined for several proteins that contain SAM domains, including Ets-1 transcription factor, which plays a role in the development and invasion of tumour cells by regulating the expression of matrix-degrading proteases [[cite:PUB00014043]]; Etv6 transcription factor, gene rearrangements of which have been demonstrated in several malignancies [[cite:PUB00014044]]; EphA4 receptor tyrosine kinase, which is believed to be important for the correct localization of a motoneuron pool to a specific position in the spinal cord [[cite:PUB00014045]]; EphB2 receptor, which is involved in spine morphogenesis via intersectin, Cdc42 and N-Wasp [[cite:PUB00014046]]; p73, a p53 homologue involved in neuronal development [[cite:PUB00014047]]; and polyhomeotic, which is a member of the Polycomb group of genes (Pc-G) required for the maintenance of the spatial expression pattern of homeotic genes [[cite:PUB00014048]].</p>	FALSE	FALSE
IPR011011	Zinc finger, FYVE/PHD-type	<p>The FYVE zinc finger domain is conserved from yeast to man, and is named after four proteins that it has been found in: Fab1, YOTB/ZK632.12, Vac1, and EEA1. It functions in the membrane recruitment of cytosolic proteins by binding to phosphatidylinositol 3-phosphate (PI3P), which is found mainly on endosomes [[cite:PUB00014078], [cite:PUB00014077]].</p>  <p>The plant homeodomain (PHD) zinc finger domain has a C4HC3-type motif, and is widely distributed in eukaryotes, being found in many chromatin regulatory factors [[cite:PUB00014079]].</p>  <p>Both the FYVE and the PHD zinc finger motifs display strikingly similar dimetal(zinc)-bound α+β folds.</p>	FALSE	FALSE
IPR011333	SKP1/BTB/POZ domain superfamily	<p>The BTB (for BR-C, ttk and bab) [[cite:PUB00004829]] or POZ (for Pox virus and Zinc finger) [[cite:PUB00001918], [cite:PUB00035688]] domain is a versatile protein-protein interaction motif involved in many cellular functions, including transcriptional regulation, cytoskeleton dynamics, ion channel assembly and gating, and targeting proteins for ubiquitination [[cite:PUB00033636]]. The BTB domain can occur alongside other domains: BTB-zinc finger (BTB-ZF), BTB-BACK-Kelch (BBK), voltage-gated potassium channel T1 (T1-Kv) [[cite:PUB00035689]], MATH-BTB, BTB-NPH3 and BTB-BACK-PHR (BBP). Other proteins, such as Skp1 and ElonginC, consist almost exclusively of the core BTB fold. In all of these protein families, the BTB core fold is structurally conserved, consisting of a 2-layer α/β topology where a cluster of α-helices is flanked by short β-sheets [[cite:PUB00004917]]. POZ domains from several zinc finger proteins have been shown to mediate transcriptional repression and to interact with components of histone deacetylase co-repressor complexes including N-CoR and SMRT [[cite:PUB00000971], [cite:PUB00004499], [cite:PUB00003026]]. The POZ or BTB domain is also known as BR-C/Ttk or ZiN.</p>  <p>This entry includes the BTB/POZ domain, as well as  Skp1 N-terminal region which has an α/β structure similar to that of the BTB/POZ domain fold [[cite:PUB00035689], [cite:PUB00010628]].</p>	FALSE	FALSE
IPR035500	Nuclear hormone receptor-like domain superfamily	<p>Steroid or nuclear hormone receptors constitute an important superfamily of transcription regulators that are involved in widely diverse physiological functions, including control of embryonic development, cell differentiation and homeostasis. The receptors function as dimeric molecules in nuclei to regulate the transcription of target genes in a ligand-responsive manner. Nuclear hormone receptors consist of a highly conserved DNA-binding domain that recognises specific sequences ([interpro:IPR001628]), connected via a linker region to a C-terminal ligand-binding domain. In addition, certain nuclear hormone receptors have an N-terminal modulatory domain ([interpro:IPR046944]). The ligand-binding domain acts in response to ligand binding, which caused a conformational change in the receptor to induce a response, thereby acting as a molecular switch to turn on transcriptional activity [[cite:PUB00016720]]. For example, after binding of the glucocorticoid receptor to the corticosteroid ligand, the receptor is induced to perform functions ranging from nuclear translocation, oligomerization, cofactor/kinase/transcription factor association, and DNA binding [[cite:PUB00016721]]. The ligand-binding domain is a flexible unit, where the binding of a ligand stabilises its conformation, which in turn favours coactivator binding to modify receptor activity [[cite:PUB00016722]]; the coactivator can bind to the activator function 2 (AF2) site at the C-terminal end of the ligand-binding domain [[cite:PUB00016725]]. The binding of different ligands can alter the conformation of the ligand-binding domain, which ultimately affects the DNA-binding specificity of the DNA-binding domain. In the absence of ligand, steroid hormone receptors are thought to be weakly associated with nuclear components.</p>  <p>This entry represents the all helical domain involved in ligand-binding.</p>	TRUE	FALSE
IPR008967	p53-like transcription factor, DNA-binding domain superfamily	<p>This domain superfamily is found in a number of transcription factors, including p53, NFATC, TonEBP, STAT-1, and NFkappaB, where it is responsible for DNA-binding.  These transcription factors play diverse roles in the regulation of cellular functions: the p53 tumour suppressor upregulates the expression of genes involved in cell cycle arrest and apoptosis [[cite:PUB00011797]]; NFATC regulates the production of effector proteins involved in coordinating the immune response [[cite:PUB00011799]]; TonEBP regulates gene expression induced by osmotic stress and helps regulate intracellular volume during cell growth [[cite:PUB00011802]]; STAT-1 plays an important role in B lymphocyte growth and function [[cite:PUB00011801]]; and NFkappaB is involved in the inflammatory response [[cite:PUB00011803]].  The DNA-binding domain acts to clamp, or in the case of TonEBP, encircle the DNA target in order to stabilise the protein-DNA complex [[cite:PUB00011800]].  Protein interactions may also serve to stabilise the protein-DNA complex, for example in the STAT-1 dimer the SH2 (Src homology 2) domain in each monomer is coupled to the DNA-binding domain to increase stability [[cite:PUB00011807]].  The DNA-binding domain consists of a β-sandwich formed of 9 strands in 2 sheets with a Greek-key topology. This structure is found in many transcription factors, often within the DNA-binding domain.</p>	TRUE	FALSE
IPR010982	Lambda repressor-like, DNA-binding domain superfamily	<p>Bacteriophage lambda C1 repressor controls the expression of viral genes as part of the lysogeny/lytic growth switch. C1 is essential for maintaining lysogeny, where the phage replicates non-disruptively along with the host. If the host cell is threatened, then lytic growth is induced. The Lambda C1 repressor consists of two domains connected by a linker: an N-terminal DNA-binding domain that also mediates interactions with RNA polymerase, and a C-terminal dimerisation domain [[cite:PUB00014015]]. The DNA-binding domain consists of four helices in a closed folded leaf motif. Several different phage repressors from different helix-turn-helix families contain DNA-binding domains that adopt a similar topology. These include the Lambda Cro repressor, Bacteriophage 434 C1 and Cro repressors, P22 C2 repressor, and Bacteriophage Mu Ner protein.</p> <p>The DNA-binding domain of Bacillus subtilis spore inhibition repressor SinR is identical to that of phage repressors [[cite:PUB00014013]]. SinR represses sporulation, which only occurs in response to adverse conditions. This provides a possible evolutionary link between the two adaptive responses of bacterial sporulation and prophage induction.</p> <p>Other DNA-binding domains also display similar structural folds to that of Lambda C1. These include bacterial regulators such as the purine repressor (PurR), the lactose repressor (Lacr) and the fructose repressor (FruR), each of which has an N-terminal DNA-binding domain that exhibits a fold similar to that of lambda C1, except that they lack the first helix [[cite:PUB00014016], [cite:PUB00014017], [cite:PUB00014018]]. POU-specific domains found in transcription factors such as in Oct-1, Pit-1 and Hepatocyte nuclear factor 1a (LFB1/HNF1) display four-helical fold DNA-binding domains similar to that of Lambda C1 [[cite:PUB00014019], [cite:PUB00007265], [cite:PUB00014020]]. The N-terminal domain of cyanase has an α-helix bundle motif similar to Lambda C1, but it probably does not bind DNA. Cyanase is an enzyme found in bacteria and plants that catalyses the reaction of cyanate with bicarbonate to produce ammonia and carbon dioxide in response to extracellular cyanate [[cite:PUB00008198]].</p>	TRUE	FALSE
IPR035965	PAS domain superfamily	<p>PAS domains are involved in many signalling proteins where they are used as a signal sensor domain [[cite:PUB00015791]]. PAS domains appear in archaea, bacteria and eukaryotes. Several PAS-domain proteins are known to detect their signal by way of an associated cofactor. Heme, flavin, and a 4-hydroxycinnamyl chromophore are used in different proteins. The PAS domain was named after three proteins that it occurs in:</p> <ul> <li>Per- period circadian protein</li> <li>Arnt- Ah receptor nuclear translocator protein</li> <li>Sim-  single-minded protein.</li> </ul> <p>PAS domains are often associated with PAC domains [interpro:IPR001610].  It appears that these domains are directly linked, and that together they form the conserved 3D PAS fold.  The division between the PAS and PAC domains is caused by major differences in sequences in the region connecting these two motifs [[cite:PUB00014500]].  In human PAS kinase, this region has been shown to be very flexible, and adopts different conformations depending on the bound ligand [[cite:PUB00014501]]. Probably the most surprising identification of a PAS domain was that in EAG-like K<sup></sup>-channels [[cite:PUB00005472]].</p>	FALSE	FALSE
IPR046347	Basic-leucine zipper domain superfamily	<p>The basic-leucine zipper (bZIP) domain transcription factors [[cite:PUB00004967]] of eukaryotic are proteins that contain a basic region mediating sequence-specific DNA-binding followed by a leucine zipper region required for dimerisation.</p>  <p>Several structure of bZIP have been solved. The basic region and the leucine zipper form a contiguous α-helix where the four hydrophobic residues of the leucine zipper are oriented on one side. This conformation allows dimerisation in parallel and it bends the helices so that the newly functional dimer forms a flexible fork where the basic domains, at the N-terminal open end, can then interact with DNA. The two leucine zipper are therefore oriented perpendicular to the DNA [[cite:PUB00017872]].</p>	TRUE	FALSE
IPR008917	Transcription factor, Skn-1-like, DNA-binding domain superfamily	<p>The DNA-binding domain of certain eukaryotic transcription factors displays a distinctive helix-turn-helix (HTH) motif.  The MafG basic region-leucine zipper (bZIP) protein and the Caenorhabditis elegans Skn-1 transcription factor share this HTH motif.</p> <p>MafG is a member of the Maf family of proteins, which are a subgroup of bZIP proteins that function as transcriptional regulators of cellular differentiation.  Mafs can form either homodimers, or heterodimers with other bZIP proteins through their leucine zipper domains.  MafG proteins are small Mafs that lack a putative transactivation domain.  The DNA-binding domain of MafG contains the conserved Maf extended homology region (EHR), which is not present in other bZIP proteins.  The EHR together with the basic region are responsible for the DNA-binding specificity of Mafs.</p> <p>Skn-1 is a transcription factor that specifies mesodermal development in C. elegans.  Skn-1 and MafG share a conserved DNA-binding motif, however Skn-1 lacks the leucine zipper dimerisation domain that is found in all bZIP proteins.  Skn-1 acts as a monomer.</p>	TRUE	FALSE
