	Name	Description	DNA-binding	Histone-interaction
IPR036361	SAP domain superfamily	<p>The SAP motif is a 35-residue motif, which has been named after SAF-A/B, Acinus and PIAS, three proteins known to contain it. The SAP motif is found in a variety of nuclear proteins involved in transcription, DNA repair, RNA processing or apoptotic chromatin degradation. As the sap motif of SAF-A has been shown to be essential for specific DNA binding activity, it has been proposed that it could be a DNA-binding motif [[cite:PUB00006479]].</p>  <p>A multiple alignment of the SAP motif reveals a bipartite distribution of strongly conserved hydrophobic, polar and bulky amino acids separated by a region that contains a glycine. Secondary structure predictions suggest that the SAP motif could form two α helices separated by a turn [[cite:PUB00006479]].</p>  <p>Some proteins known to contain a SAP motif are listed below:</p>  <ul>  <li>Vertebrate scaffold attachment factors A and B (SAF-A/B). These two proteins are heterogeneous nuclear ribonucleoproteins (hnRNPs) that bind to AT-rich chromosomal region. It has been proposed that they couple RNA metabolism to nuclear organisation [[cite:PUB00018259], [cite:PUB00018260]]. The SAF-A protein is cleaved by caspase-3 during apoptosis [[cite:PUB00018261]].</li> <li>Mammalian Acinus, a protein which induces apoptotic chromatin condensation after cleavage by caspase-3 [[cite:PUB00018262]]. Acinus also contains a RNA-recognition motif.</li> <li>Eukaryotic proteins of the PIAS (protein inhibitor of activated STAT) family. These proteins interact with phosphorylated STAT dimers and inhibit STAT mediated gene activation. Deletion of the first 50 amino acid residues containing the SAP domain allows the interaction of PIAS1 with STAT1 monomer [[cite:PUB00018264]].</li> <li>Plant poly(ADP-ribose) polymerase (PARP). PARP is a nuclear protein that catalyzes the poly(ADP-ribosyl)ation of proteins. It is involved in responses to mild and severe oxidative stresses, by mediating DNA repair and programmed cell death processes, respectively [[cite:PUB00018265]]. PARP is tightly bound to chromatin or nuclear matrix.</li> <li>Arabidopsis thaliana Arp, an apurinic endonuclease-redox protein.</li> <li>Yeast THO1 protein. It could be involved in the regulation of transcriptional elongation by RNA polymerase II [[cite:PUB00018266]].</li> <li>Animal Ku70. Together with Ku86, it forms a DNA ends binding complex that is involved in repairing DNA double-strand breaks.</li> <li>Yeast RAD18, a protein involved in DNA repair.</li> <li>Neurospora crassa UVS-2, the homologue of RAD18.</li></ul>	FALSE	FALSE
IPR036531	Rabenosyn, Rab binding domain superfamily	<p>Rabenosyn-5 (Rbsn) is a multivalent effector with interacts with the Rab family. Rsbn contains distinct Rab4 and Rab5 binding sites within residues 264-500 and 627-784 respectively [[cite:PUB00038633]]. Rab proteins are GTPases involved in the regulation of all stages of membrane trafficking [[cite:PUB00038633]].</p>	FALSE	FALSE
IPR036875	Zinc finger, CCHC-type superfamily	<p>Zinc finger (Znf) domains are relatively small protein motifs which contain multiple finger-like protrusions that make tandem contacts with their target molecule. Some of these domains bind zinc, but many do not; instead binding other metals such as iron, or no metal at all. For example, some family members form salt bridges to stabilise the finger-like folds. They were first identified as a DNA-binding motif in transcription factor TFIIIA from Xenopus laevis (African clawed frog), however they are now recognised to bind DNA, RNA, protein and/or lipid substrates [[cite:PUB00035807], [cite:PUB00035805], [cite:PUB00035806], [cite:PUB00035804], [cite:PUB00014077]]. Their binding properties depend on the amino acid sequence of the finger domains and of the linker between fingers, as well as on the higher-order structures and the number of fingers. Znf domains are often found in clusters, where fingers can have different binding specificities. There are many superfamilies of Znf motifs, varying in both sequence and structure. They display considerable versatility in binding modes, even between members of the same class (e.g. some bind DNA, others protein), suggesting that Znf motifs are stable scaffolds that have evolved specialised functions. For example, Znf-containing proteins function in gene transcription, translation, mRNA trafficking, cytoskeleton organisation, epithelial development, cell adhesion, protein folding, chromatin remodelling and zinc sensing, to name but a few [[cite:PUB00035812]]. Zinc-binding motifs are stable structures, and they rarely undergo conformational changes upon binding their target.</p>	FALSE	FALSE
IPR035892	C2 domain superfamily	<p>The C2 domain is a Ca<sup>2+</sup>-dependent membrane-targeting module found in many cellular proteins involved in signal transduction or membrane trafficking. C2 domains are unique among membrane targeting domains in that they show wide range of lipid selectivity for the major components of cell membranes, including phosphatidylserine and phosphatidylcholine. This C2 domain is about 116 amino-acid residues and is located between the two copies of the C1 domain in Protein Kinase C and the protein kinase catalytic domain [[cite:PUB00081923]]. Regions with significant homology [[cite:PUB00002925]] to the C2-domain have been found in many proteins. The C2 domain is thought to be involved in calcium-dependent phospholipid binding [[cite:PUB00002815]] and in membrane targetting processes such as subcellular localisation.</p>  <p>The 3D structure of the C2 domain of synaptotagmin has been reported [[cite:PUB00000918]], the domain forms an eight-stranded β-sandwich constructed around a conserved 4-stranded motif, designated a C2 key [[cite:PUB00000918]]. Calcium binds in a cup-shaped depression formed by the N- and C-terminal loops of the C2-key motif. Structural analyses of several C2 domains have shown them to consist of similar ternary structures in which three Ca<sup>2+</sup>-binding loops are located at the end of an 8 stranded antiparallel β-sandwich.</p>	FALSE	FALSE
IPR036507	Telomere repeat-binding factor, dimerisation domain superfamily	<p>Telomeres function to shield chromosome ends from degradation and end-to-end fusions, as well as preventing the activation of DNA damage checkpoints. Telomeric repeat binding factor (TRF) proteins TRF1 and TRF2 are major components of vertebrate telomeres required for regulation of telomere stability. TRF1 and TRF2 bind to telomeric DNA as homodimers. Dimerisation involves the TRF homology (TRFH) subdomain contained within the dimerisation domain. The TRFH subdomain is important not only for dimerisation, but for DNA binding, telomere localisation, and interactions with other telomeric proteins. The dimerisation domains of TRF1 and TRF2 show the same multi-helical structure, arranged in a solenoid conformation similar to TPR repeats, which can be divided into an α-α superhelix and a long α hairpin [[cite:PUB00013264]].</p>   <p>The two related human TRF proteins hTRF1 and hTRF2 form homodimers and bind directly to telomeric TTAGGG repeats via the myb DNA binding domain [interpro:IPR001005] at the carboxy terminus [[cite:PUB00033335]]. TRF1 is implicated in telomere length regulation and TRF2 in telomere protection [[cite:PUB00033335]]. Other telomere complex associated proteins are recruited through their interaction with either TRF1 or TRF2. The fission yeast protein Taz1p (telomere-associated in Schizosaccharomyces pombe (Fission yeast) has similarity to both hTRF1 and hTRF2 and may perform the dual functions of TRF1 and TRF2 at fission yeast telomeres [[cite:PUB00033336]].</p>	TRUE	FALSE
IPR023219	Hepatocyte nuclear factor 1, N-terminal domain superfamily	<p>The N-terminal dimerisation domain of the transcriptional activator hepatocyte nuclear factor 1 is essential for DNA binding and association of the transcriptional coactivator, DCoH (dimerization cofactor of HNF-1). This domain forms a unique four-helical bundle which is largely conserved when dimerisation occurs [[cite:PUB00014014]].</p>	TRUE	FALSE
IPR036060	Zinc finger, C2H2C-type superfamily	<p>Zinc finger (Znf) domains are relatively small protein motifs which contain multiple finger-like protrusions that make tandem contacts with their target molecule. Some of these domains bind zinc, but many do not; instead binding other metals such as iron, or no metal at all. For example, some family members form salt bridges to stabilise the finger-like folds. They were first identified as a DNA-binding motif in transcription factor TFIIIA from Xenopus laevis (African clawed frog), however they are now recognised to bind DNA, RNA, protein and/or lipid substrates [[cite:PUB00035807], [cite:PUB00035805], [cite:PUB00035806], [cite:PUB00035804], [cite:PUB00014077]]. Their binding properties depend on the amino acid sequence of the finger domains and of the linker between fingers, as well as on the higher-order structures and the number of fingers. Znf domains are often found in clusters, where fingers can have different binding specificities. There are many superfamilies of Znf motifs, varying in both sequence and structure. They display considerable versatility in binding modes, even between members of the same class (e.g. some bind DNA, others protein), suggesting that Znf motifs are stable scaffolds that have evolved specialised functions. For example, Znf-containing proteins function in gene transcription, translation, mRNA trafficking, cytoskeleton organisation, epithelial development, cell adhesion, protein folding, chromatin remodelling and zinc sensing, to name but a few [[cite:PUB00035812]]. Zinc-binding motifs are stable structures, and they rarely undergo conformational changes upon binding their target.</p>	TRUE	FALSE
IPR016181	Acyl-CoA N-acyltransferase	<p>This entry represents a structural domain found in several acyl-CoA acyltransferase enzymes. This domain has a 3-layer α/β/α structure that contains mixed β-sheets, and can be found in the following proteins:</p>  <ul> <li>N-acetyl transferase (NAT) family members, including aminoglycoside N-acetyltransferases [[cite:PUB00027579]], the histone acetyltransferase domain of P300/CBP associating factor PCAF [[cite:PUB00023984]], the catalytic domain of GCN5 histone acetyltransferase [[cite:PUB00006453]], and diamine acetyltransferase 1 [[cite:PUB00039506]].</li> <li>Autoinducer synthetases, such as protein LasI [[cite:PUB00030742]] and acyl-homoserinelactone synthase EsaI [[cite:PUB00026875]].</li> <li>Leucyl/phenylalanyl-tRNA-protein transferase (LFTR), a close relative of the non-ribosomal peptidyltransferases; there is a deletion of the N-terminal half of the N-terminal NAT-like domain after the domain duplication/swapping events [[cite:PUB00040115]].</li> <li>Ornithine decarboxylase antizyme, which may have evolved a different function for this domain, although the putative active site maps to the same location in the common fold.</li> <li>Arginine N-succinyltransferase, alpha chain, AstA, which contains an extra C-terminal domain that is similar to the double-psi β-barrel fold domain (missing one strand and untangled ψ-loops).</li> </ul>  <p>Several proteins carry a duplication of this domain, which consists of two NAT-like domains swapped with the C-terminal strands, including:</p>  <ul> <li>N-myristoyl transferase (NMT) [[cite:PUB00026039]].</li> <li>FemXAB non ribosomal peptidyl transferases, including methicillin-resistance protein FemA (transfer glycyl residue from tRNA-Gly) [[cite:PUB00014008]] and peptidyl transferase FemX [[cite:PUB00029031]].</li> <li>Hypothetical protein cg14615-pa from Drosophila melanogaster (Fruit fly).</li> </ul>	FALSE	FALSE
IPR011047	Quinoprotein alcohol dehydrogenase-like superfamily	<p>Quinoprotein alcohol dehydrogenases are a family of proteins found in methylotrophic or autotrophic bacteria. These quinoproteins use pyrroloquinoline quinone as their prosthetic group. There are three types of alcohol dehydrogenases: type I includes methanol dehydrogenase and ethanol dehydrogenase, type II includes soluble quinohaemoprotein with a C-terminal containing haem C, and type III includes quinoprotein alcohol dehydrogenase with a C-terminal cytochrome C domain [[cite:PUB00014164]]. These quinoproteins contain an 8-bladed β-propeller motif, which is present in the N-terminal domain of quinoprotein alcohol dehydrogenase, ethanol dehydrogenase, and the heavy chain (alpha subunit) of methanol dehydrogenase ([ec:1.1.99.8]) [[cite:PUB00014163], [cite:PUB00014162], [cite:PUB00014161]].</p>  <p>This entry represents quinoprotein alcohol dehydrogenases as well as some other proteins that share a similar structure, including WD repeat-containing protein and echinoderm microtubule-associated protein-like proteins.</p>	FALSE	FALSE
IPR036322	WD40-repeat-containing domain superfamily	<p>This entry identifies a domain superfamily containing adjacent WD repeats. These WD repeats are located on β-sheets (blades) that fold into a higher order  structure called β-propeller.</p>	TRUE	FALSE
IPR036291	NAD(P)-binding domain superfamily	<p>This entry represents NAD- and NADP-binding domains superfamily with a core Rossmann-type fold, which consists of three layers (α/β/α) with parallel β-sheet of 6 strands. Many different enzymes contain an NAD/NADP-binding domain, including:</p>  <ul> <li>C-terminal domain of alcohol dehydrogenases [[cite:PUB00031657]]</li> <li>Tyrosine-dependent oxidoreductases (also known as short-chain dehydrogenases) [[cite:PUB00000446]]</li> <li>N-terminal domain of glyceraldehyde-3-phosphate dehydrogenase [[cite:PUB00023536]]</li> <li>NAD-binding domain of formate/glycerate dehydrogenases [[cite:PUB00032846]]</li> <li>N-terminal domain of sirohaem synthase [[cite:PUB00029889]]</li> <li>N-terminal domain of lactate dehydrogenase [[cite:PUB00025866]]</li> <li>N-terminal domain of 6-phosphogluconate dehydrogenase (the β-sheet is extended to 8 strands) [[cite:PUB00041823]]</li> <li>C-terminal domain of amino acid dehydrogenases (an extra N-terminal helix displaces the C-terminal helix [[cite:PUB00025375]]</li> <li>NAD-binding domain of certain potassium channels [[cite:PUB00025981]]</li> <li>C-terminal domain of the transcriptional repressor Rex [[cite:PUB00032388]]</li> <li>Ornithine cyclodeaminase [[cite:PUB00031693]]</li> <li>CoA-binding N-terminal domain of the alpha chain of succinyl-CoA synthetase [[cite:PUB00015984]]</li> </ul>	FALSE	FALSE
IPR008927	6-phosphogluconate dehydrogenase-like, C-terminal domain superfamily	<p>6-phosphogluconate dehydrogenase ([ec:1.1.1.44]) catalyses the oxidative decarboxylation of 6-phosphogluconate to ribulose 5-phosphate with the concomitant reduction of NADP to NADPH. The metazoan 6PGDHs have a well-conserved glycine-serine rich sequence at the C terminus, which is lacking from bacterial enzymes and from those of the parasitic protozoan Trypanosoma brucei. The active dimer of the mammalian enzyme assembles with the C-terminal tail of one subunit threaded through the other, forming part of the substrate-binding site. The tail of T. brucei 6PGDH is shorter than that of the mammalian enzyme and its terminal residues associate tightly with the second monomer. The three-dimensional structure shows this generates additional interactions between the subunits close to the active site; the coenzyme-binding domain is thereby associated more tightly with the helical domain. Three residues, conserved in all other known sequences, are important in creating a salt bridge between monomers close to the substrate-binding site [[cite:PUB00010616]].</p> <p>This domain is structurally similar to domains found in several different families, including those represented by mannitol 2-dehydrogenase, acetohydroxy acid isomeroreductase, short chain L-3-hydroxyacyl CoA dehydrogenase, UDP-glucose/GDP-mannose dehydrogenase (dimerisation domain), N-(1-D-carboxylethyl)-L-norvaline dehydrogenase, glycerol-3-phosphate dehydrogenase, and ketopantoate reductase (PanE).</p>	FALSE	FALSE
IPR037213	RUN domain superfamily	<p>The RUN domain, named after RPIP8, unc-14 and NESCA, is organised into six conserved blocks (A-F), which constitute the 'core' of a globular structure tolerating insertions of considerable length between the conserved blocks [[cite:PUB00102668]]. The RUN domain is found in one or two copies in several proteins that are linked particularly to the functions of GTPases in the Rap and Rab families. This domain is thought to be a specific effector of small GTPases, but in the case of many of RUN domains their specific partners and their roles need to be determined. RUN domains can be associated with TBC/rab GAP, FYVE, DENN, SH3, DAG/PE-binding, PLAT/LH2, PH or PX domains. The RUN domain may have a role in the interaction of various proteins with cytoskeletal filaments [[cite:PUB00018297]].</p>	FALSE	FALSE
IPR035969	Rab-GAP-TBC domain superfamily	<p>The ~200 amino acid TBC/rab GTPase-activating protein (GAP) domain is well conserved across species and has been found in a wide range of different proteins from plant adhesion molecules to mammalian oncogenes. The name TBC derives from the name of the murine protein Tbc1 in which this domain was first identified based on its similarity to sequences in the tre-2 oncogene, and the yeast regulators of mitosis, BUB2 and cdc16 [[cite:PUB00004496]]. The connection of this domain with rab GTPase activation stems from subsequent in-depth sequence analyses and alignments [[cite:PUB00005468]] and recent work demonstrating that it appears to contain the catalytic activities of the yeast rab GAPs, GYP1, and GYP7 [[cite:PUB00018101]].</p>  <p>The TBC/rab GAP domain has also been named PTM after three proteins known to contain it: the Drosophila pollux, the human oncoprotein TRE17 (oncoTRE17), and a myeloid cell line-expressed protein [[cite:PUB00018102]]. The TBC/rab GAP domain contains six conserved motifs named A to F [[cite:PUB00005468]]. A conserved arginine residue in the sequence motif B has been shown to be critical for the full GAP activity [[cite:PUB00018101]]. Resolution of the 3D structure of the TBC/rab GAP domain of GYP1 has shown that it is a fully α-helical V-shaped molecule. The conserved arginine residue is positioned at the side of the narrow cleft on the concave site of the V-shaped molecule. It has been proposed that this cleft is the binding site for the GTPase. The conserved arginine residue probably functions as a catalytic arginine finger analogous to that seen in ras and Rho-GAPs. The two key features of the arginine finger activation mechanism appear to be (i) the positioning of the catalytically essential GTPase glutamine side chain via a hydrogen bonding interaction between the glutamine carbamoyl-NH2 group and the main chain carbonyl group of the GAP arginine, and (ii) the polarization of the gamma-phosphate group or the stabilization of charge on it via the interaction of the positively charged side chain guanidinoyl group of the GAP arginine [[cite:PUB00014098]].</p>	FALSE	FALSE
IPR036855	Zinc finger, CCCH-type superfamily	<p>Zinc finger (Znf) domains are relatively small protein motifs which contain multiple finger-like protrusions that make tandem contacts with their target molecule. Some of these domains bind zinc, but many do not; instead binding other metals such as iron, or no metal at all. For example, some family members form salt bridges to stabilise the finger-like folds. They were first identified as a DNA-binding motif in transcription factor TFIIIA from Xenopus laevis (African clawed frog), however they are now recognised to bind DNA, RNA, protein and/or lipid substrates [[cite:PUB00035807], [cite:PUB00035805], [cite:PUB00035806], [cite:PUB00035804], [cite:PUB00014077]]. Their binding properties depend on the amino acid sequence of the finger domains and of the linker between fingers, as well as on the higher-order structures and the number of fingers. Znf domains are often found in clusters, where fingers can have different binding specificities. There are many superfamilies of Znf motifs, varying in both sequence and structure. They display considerable versatility in binding modes, even between members of the same class (e.g. some bind DNA, others protein), suggesting that Znf motifs are stable scaffolds that have evolved specialised functions. For example, Znf-containing proteins function in gene transcription, translation, mRNA trafficking, cytoskeleton organisation, epithelial development, cell adhesion, protein folding, chromatin remodelling and zinc sensing, to name but a few [[cite:PUB00035812]]. Zinc-binding motifs are stable structures, and they rarely undergo conformational changes upon binding their target.</p>	FALSE	FALSE
IPR015947	PUA-like superfamily	<p>This superfamily represents domains with a PUA-like structure, consisting of a pseudo-barrel composed of mixed folded sheets of five strands. This structural motif is found in:</p>  <ul><li>PUA-containing proteins.</li> <li>The N-terminal of ATP sulphurylases, which contains extra structures, some similar to the PK β-barrel domain [[cite:PUB00014132]].</li> <li>Several bacterial hypothetical proteins, such as the N-terminal domain of YggJ [[cite:PUB00029267]].</li></ul>  <p>The PUA (PseudoUridine synthase and Archaeosine transglycosylase) domain was named after the proteins in which it was first found [[cite:PUB00003444]]. PUA is a highly conserved RNA-binding motif found in a wide range of archaeal, bacterial and eukaryotic proteins, including enzymes that catalyse tRNA and rRNA post-transcriptional modifications, proteins involved in ribosome biogenesis and translation, as well as in enzymes involved in proline biosynthesis [[cite:PUB00036064], [cite:PUB00036065]]. The structures of several PUA-RNA complexes reveal a common RNA recognition surface, but also some versatility in the way in which the motif binds to RNA [[cite:PUB00036063]]. PUA motifs are involved in dyskeratosis congenita and cancer, pointing to links between RNA metabolism and human diseases [[cite:PUB00036066]].</p>	FALSE	FALSE
IPR038765	Papain-like cysteine peptidase superfamily	<p>This entry represents the papain-like cysteine peptidase superfamily. Its members typically consist of one α-helix and 4 strands of antiparallel β-sheet and contain the catalytic triad Cys-His-Asn.</p>	FALSE	FALSE
IPR008936	Rho GTPase activation protein	<p>Proteins containing a RhoGAP (Rho GTPase Activating Protein) domain usually function to catalyse the hydrolysis of GTP that is bound to Rho, Rac and/or Cdc42, inactivating these regulators of the actin cytoskeleton. The 53 known human RhoGAP domain-containing proteins are the largest known group of Rho GTPase regulators and significantly outnumber the 21 Rho GTPases they presumably regulate. This excess of GAP proteins probably indicates complex regulation of the Rho GTPases and is consistent with the existence of almost as many (48) human Dbl domain-containing Rho GEFs that act antagonistically to the RhoGAP proteins by activating the Rho GTPases. Phylogenetic analysis offers evidence for frequent domain duplication and for duplication of the entire genes containing these GAP domains [[cite:PUB00010623]].</p>	FALSE	FALSE
IPR036517	FF domain superfamily	<p>This entry represents the FF domain superfamily.</p>	FALSE	FALSE
IPR036792	Aspartate carbamoyltransferase regulatory subunit, C-terminal domain superfamily	<p>Aspartate carbamoyltransferase (aspartate transcarbamylase, ATCase) [ec:2.1.3.2] is an allosteric enzyme that plays a central role in the regulation of the pyrimidine pathway in bacteria. The holoenzyme is a dodecamer composed of six catalytic chains, each with an active site, and six regulatory chains lacking catalytic activity [[cite:PUB00014302]]. The catalytic subunits exist as a dimer of catalytic trimers, (c3)2, while the regulatory subunits exist as a trimer of regulatory dimers, (r2)3, therefore the complete holoenzyme can be represented as (c3)2(r2)3. The association of the catalytic subunits c3 with the regulatory subunits r2 is responsible for the establishment of positive co-operativity between catalytic sites for the binding of aspartate and it dictates the pattern of allosteric response toward nucleotide effectors. ATCase from Escherichia coli is the most extensively studied allosteric enzyme [[cite:PUB00006327]]. The crystal structure of the T-state, the T-state with CTP bound, the R-state with N-phosphonacetyl-L-aspartate (PALA) bound, and the R-state with phosphonoacetamide plus malonate bound have been used in interpreting kinetic and mutational studies.</p>  <p>A high-resolution structure of E. coli ATCase in the presence of PALA (a bisubstrate analog) allows a detailed description of the binding at the active site of the enzyme and allows a detailed model of the tetrahedral intermediate to be constructed. The entire regulatory chain has been traced showing that the N-terminal regions of the regulatory chains R1 and R6 are located in close proximity to each other and to the regulatory site. This portion of the molecule may be involved in the observed asymmetry between the regulatory binding sites as well as in the heterotropic response of the enzyme [[cite:PUB00006470]]. The C-terminal domain of the regulatory chains have a rubredoxin-like zinc-bound fold.</p>	FALSE	FALSE
